{
  "log_index": 4,
  "interaction_id": "meta-20260219T142324Z-000004",
  "mode": "META",
  "timestamp": "2026-02-19T14:23:24Z",
  "model_name": "GPT-5.2-Codex",
  "model_version": "5.2",
  "prompt_text": "MODE: META\nVERSION: 0.2.1\nOBJECTIVE: Synchronize logging counter and enforce zero-prompt logging.",
  "response_text": "Synchronized log indexing, implemented zero-prompt logging policy/spec updates, and added automatic logger tooling.",
  "prompt_token_count": 180,
  "completion_token_count": 140,
  "latency_ms": 1700,
  "workflow_version": "0.2.1",
  "notes": "Autonomous META entry recorded after detecting and backfilling prior missing sequence."
}
