{
  "log_index": 9,
  "interaction_id": "build-20260301T170014Z-000009",
  "mode": "BUILD",
  "timestamp": "2026-03-01T17:00:14Z",
  "model_name": "GPT-5.2-Codex",
  "model_version": "5.2",
  "prompt_text": "MODE: BUILD VERSION: 0.5.0 OBJECTIVE: Add missing BuildLog and align version traceability docs.",
  "response_text": "Added BuildLog entry and aligned README/task_board version traceability to v0.5.0.",
  "prompt_token_count": 0,
  "completion_token_count": 0,
  "latency_ms": 1,
  "workflow_version": "0.5.0",
  "notes": "Backfilled missing interaction log for post-fix traceability turn."
}
