{
  "log_index": 7,
  "interaction_id": "run-20260220T124214Z-000007",
  "mode": "RUN",
  "timestamp": "2026-02-20T12:42:14Z",
  "model_name": "GPT-5.2-Codex",
  "model_version": "5.2",
  "prompt_text": "MODE: RUN STAGE: 01_Design OBJECTIVE: Generate definitive Savanna_Pulse GDD and keep task board IN_PROGRESS.",
  "response_text": "Regenerated GDD_v1.md with full universal spec compliance, required micro/macro loops, architect-facing modules, validated task board status, committed changes, and created PR metadata.",
  "prompt_token_count": 0,
  "completion_token_count": 0,
  "latency_ms": 0,
  "workflow_version": "0.4.0",
  "notes": "Autonomous interaction logging per system reminder."
}
