{
  "log_index": 7,
  "interaction_id": "build-20260220T060854Z-000007",
  "mode": "BUILD",
  "timestamp": "2026-02-20T06:08:54Z",
  "model_name": "GPT-5.2-Codex",
  "model_version": "5.2",
  "prompt_text": "Update general workflow rules to enforce universal GDD quality gate for all design stages.",
  "response_text": "Replaced Design Freeze Gate with Universal Design Quality Gate tied to Workflow/Rules/universal_gdd_spec.md for all design-stage FROZEN decisions.",
  "prompt_token_count": 0,
  "completion_token_count": 0,
  "latency_ms": 0,
  "workflow_version": "0.3.1",
  "notes": "Logged modification of Workflow/Rules/general_workflow_rules.md."
}
