{
  "log_index": 6,
  "interaction_id": "build-20260220T061846Z-000006",
  "mode": "BUILD",
  "timestamp": "2026-02-20T06:18:46Z",
  "model_name": "GPT-5.2-Codex",
  "model_version": "5.2",
  "prompt_text": "Consolidate fragmented 0.3.1 logs, reinforce autonomous zero-check logging instinct, and clean redundant artifacts.",
  "response_text": "Consolidated prior fragmented logs into canonical 000005 entry, removed 000006-000008 fragments, updated interaction logger spec with one-to-one atomic logging enforcement, removed redundant gdd_standard_spec.md, and verified universal_gdd_spec remains clean.",
  "prompt_token_count": 0,
  "completion_token_count": 0,
  "latency_ms": 0,
  "workflow_version": "0.3.2",
  "notes": "Atomic 0.3.2 cleanup log for consolidation + instinct reinforcement + universal spec verification."
}
