{
  "log_index": 2,
  "interaction_id": "meta-20260219T140149Z-000002",
  "mode": "META",
  "timestamp": "2026-02-19T14:01:49Z",
  "model_name": "GPT-5.2-Codex",
  "model_version": "5.2",
  "prompt_text": "MODE: META OBJECTIVE: Optimize data integrity check script.",
  "response_text": "Added a built-in integrity checker script for interaction logs and updated policy/spec to reference it.",
  "prompt_token_count": 60,
  "completion_token_count": 80,
  "latency_ms": 900,
  "workflow_version": "0.1.1",
  "notes": "Follow-up META run to harden data integrity validation without external dependencies."
}
