{
  "log_index": 1,
  "interaction_id": "meta-20260219T135440Z-000001",
  "mode": "META",
  "timestamp": "2026-02-19T13:54:40Z",
  "model_name": "GPT-5.2-Codex",
  "model_version": "5.2",
  "prompt_text": "MODE: META\nOBJECTIVE: Activate mandatory logging policy.\nREQUIREMENTS: no response without InteractionLog entry, unique index, incremental storage under MetaData/InteractionLogs, add MetaData/logging_policy.md. VERSION_BUMP: 0.1.1",
  "response_text": "Activated mandatory logging policy by adding MetaData/logging_policy.md, bumping workflow version to 0.1.1, extending schema/spec/example for log_index, and persisting this interaction log entry.",
  "prompt_token_count": 130,
  "completion_token_count": 95,
  "latency_ms": 1650,
  "workflow_version": "0.1.1",
  "notes": "Initial mandatory policy enforcement entry with indexed filename format."
}
