{
  "log_index": 3,
  "interaction_id": "build-20260219T141000Z-000003",
  "mode": "BUILD",
  "timestamp": "2026-02-19T14:10:00Z",
  "model_name": "GPT-5.2-Codex",
  "model_version": "5.2",
  "prompt_text": "MODE: BUILD\nVERSION: 0.2.0\nOBJECTIVE: Initialize the core structure of the Workflow system.",
  "response_text": "Initialized workflow core assets by updating workflow_config and creating pipeline and state policy documents.",
  "prompt_token_count": 120,
  "completion_token_count": 110,
  "latency_ms": 1500,
  "workflow_version": "0.2.0",
  "notes": "Backfilled missing interaction log for v0.2.0 workflow initialization to preserve contiguous sequence."
}
