{
  "log_index": 5,
  "interaction_id": "build-20260220T060832Z-000005",
  "mode": "BUILD",
  "timestamp": "2026-02-20T06:08:32Z",
  "model_name": "GPT-5.2-Codex",
  "model_version": "5.2",
  "prompt_text": "Consolidated prior fragmented 0.3.1 logging entries into one atomic record covering Rules, Roles, and Metadata updates.",
  "response_text": "Unified logging for prior turn: added universal GDD spec, updated general workflow quality gate, updated Designer role adherence, and recorded metadata/logging actions in one comprehensive entry.",
  "prompt_token_count": 0,
  "completion_token_count": 0,
  "latency_ms": 0,
  "workflow_version": "0.3.1",
  "notes": "Consolidated log representing previous-turn changes across Workflow/Rules, Workflow/Roles, and MetaData/InteractionLogs; supersedes fragmented 000006-000008 entries."
}
