{
  "log_index": 8,
  "interaction_id": "build-20260301T170013Z-000008",
  "mode": "BUILD",
  "timestamp": "2026-03-01T17:00:13Z",
  "model_name": "GPT-5.2-Codex",
  "model_version": "5.2",
  "prompt_text": "MODE: BUILD VERSION: 0.5.0 OBJECTIVE: Integrate Stage Gate governance into workflow system.",
  "response_text": "Implemented Stage Gate protocol, updated workflow rules, architect authority, handoff protocol, and bumped workflow config to 0.5.0.",
  "prompt_token_count": 0,
  "completion_token_count": 0,
  "latency_ms": 1,
  "workflow_version": "0.5.0",
  "notes": "Backfilled missing interaction log for Stage Gate governance integration turn."
}
