{
  "log_index": 6,
  "interaction_id": "build-20260220T060846Z-000006",
  "mode": "BUILD",
  "timestamp": "2026-02-20T06:08:46Z",
  "model_name": "GPT-5.2-Codex",
  "model_version": "5.2",
  "prompt_text": "Create universal_gdd_spec.md as mandatory design skeleton.",
  "response_text": "Added Workflow/Rules/universal_gdd_spec.md with required Identity, Loop Architecture, Interaction Schema, Functional Modules, and State Machine sections.",
  "prompt_token_count": 0,
  "completion_token_count": 0,
  "latency_ms": 0,
  "workflow_version": "0.3.1",
  "notes": "Logged creation of Workflow/Rules/universal_gdd_spec.md."
}
