{
  "log_index": 8,
  "interaction_id": "build-20260220T060901Z-000008",
  "mode": "BUILD",
  "timestamp": "2026-02-20T06:09:01Z",
  "model_name": "GPT-5.2-Codex",
  "model_version": "5.2",
  "prompt_text": "Update Designer_Agent role to force adherence to universal GDD spec.",
  "response_text": "Rewrote persistent instructions so Designer_Agent must follow Workflow/Rules/universal_gdd_spec.md and enforce freeze compliance.",
  "prompt_token_count": 0,
  "completion_token_count": 0,
  "latency_ms": 0,
  "workflow_version": "0.3.1",
  "notes": "Logged modification of Workflow/Roles/Designer_Agent.md."
}
